card_id,name,rarity,stone,wind,veil,oath,eye,weight,upkeep,rules_text,section,initiative_text,initiative_summary
1,Adamu,ultra,3,7,7,3,3,4,11,"Bearer of Humanity’s First Flame. When Adamu enters play, restore 50% vitality to all allies. Each defeated foe strengthens his resolve (+1 morale).",Heroes,"🌞 **Primordial Guard 10 • First Strike 10**
Embodies the Genesis Flame — negates the first three attacks each battle.
Acts before all non-divine foes. Gains morale with each ally's fall.","🌞 **Genesis Initiative (12)**
Guard 10 • First Strike 10
Dominates the opening of combat, absorbing up to three attacks per battle."
